{
  "$schema": "https://json-schema.org/draft/2020-12/schema",
  "$id": "https://workflowhub.local/schemas/skill-bundle.schema.json",
  "type": "object",
  "required": ["schema_version", "skill", "files"],
  "properties": {
    "schema_version": { "const": 1 },
    "skill": { "type": "string", "minLength": 1 },
    "files": {
      "type": "array",
      "minItems": 1,
      "items": {
        "oneOf": [
          { "type": "string", "minLength": 1 },
          {
            "type": "object",
            "required": ["path"],
            "properties": {
              "path": { "type": "string", "minLength": 1 },
              "sha256": { "type": "string", "pattern": "^[a-f0-9]{64}$" }
            },
            "additionalProperties": false
          }
        ]
      }
    },
    "sources": {
      "type": "array",
      "items": { "oneOf": [
        {
          "type": "object",
          "required": ["url", "commit", "path", "license"],
          "properties": {
            "url": { "type": "string", "pattern": "^https://github\\.com/" },
            "commit": { "type": "string", "pattern": "^[a-f0-9]{40}$" },
            "path": { "type": "string", "minLength": 1 },
            "license": { "type": "string", "minLength": 1 }
          },
          "additionalProperties": false
        },
        {
          "type": "object",
          "required": ["kind", "path", "license"],
          "properties": {
            "kind": { "const": "user-provided-local-source" },
            "path": { "type": "string", "minLength": 1 },
            "license": { "type": "string", "minLength": 1 }
          },
          "additionalProperties": false
        }
      ] }
    }
  },
  "additionalProperties": true
}
