{
  "schema_version": 1,
  "skill": "review-response",
  "files": [
    {
      "path": "LICENSE",
      "sha256": "760a1b6a1be504193f2049b8062195a9e8d26b2152e9f3a7678c9eab206fb0a4"
    },
    {
      "path": "SKILL.md",
      "sha256": "f4bd9073dea0119ccb6c0db7b73a9fd6d938b39a3f5689c17e09594c8bed89aa"
    },
    {
      "path": "scripts/validate-response.mjs",
      "sha256": "fcb76f709c8e4923c6e83964042576e75251f4b783e14da1c8d94fa01f5e2ea8"
    }
  ],
  "sources": [
    {
      "url": "https://github.com/obra/superpowers",
      "commit": "d884ae04edebef577e82ff7c4e143debd0bbec99",
      "path": "skills/receiving-code-review",
      "license": "MIT"
    }
  ]
}
